<?xml version="1.0" encoding="UTF-8"?>
<!DOCTYPE clientes SYSTEM "file:/C:/Users/Campus%20FP/Desktop/Mario/Lenguaje/hito2mario/hito.dtd">
<?xml-stylesheet type="text/xsl" href="file:/C:/Users/Campus%20FP/Desktop/Mario/Lenguaje/hito2mario/hito.xsl"?>
<clientes>
  <anio valor="2021">
    <trimestre valor="1">
      <!--pedido 1 -->
      <pedido>
        <cliente>
          <nombre>Juan</nombre>
          <apellidos>Pérez García</apellidos>
          <telefono>123456789</telefono>
          <direccion>
            <calle>Av. Libertad 123</calle>
            <ciudad>Madrid</ciudad>
            <codigoPostal>28080</codigoPostal>
            <provincia>Madrid</provincia>
          </direccion>
          <correoElectronico>juan.perez@gmail.com</correoElectronico>
          <fechaInclusion>2020-12-15</fechaInclusion>
        </cliente>
        <detallePedido>
          <numeroPedido>1001</numeroPedido>
          <fechaCompra>2021-01-10</fechaCompra>
          <fechaEntrega>2021-01-15</fechaEntrega>
          <totalFactura>150.00</totalFactura>
          <productos>
            <producto>
              <nombreProducto>Camiseta algodón</nombreProducto>
              <referencia>CA1234</referencia>
              <precio>25.00</precio>
              <unidades>2</unidades>
            </producto>
            <producto>
              <nombreProducto>Zapatillas deportivas</nombreProducto>
              <referencia>ZD5678</referencia>
              <precio>100.00</precio>
              <unidades>1</unidades>
            </producto>
          </productos>
        </detallePedido>
      </pedido>
            <!--pedido 2 (Cliente recurrente) -->
      <pedido>
        <cliente>
          <nombre>Juan</nombre>
          <apellidos>Pérez García</apellidos>
          <telefono>123456789</telefono>
          <direccion>
            <calle>Av. Libertad 123</calle>
            <ciudad>Madrid</ciudad>
            <codigoPostal>28080</codigoPostal>
            <provincia>Madrid</provincia>
          </direccion>
          <correoElectronico>juan.perez@gmail.com</correoElectronico>
          <fechaInclusion>2020-12-15</fechaInclusion>
        </cliente>
        <detallePedido>
          <numeroPedido>1002</numeroPedido>
          <fechaCompra>2021-01-12</fechaCompra>
          <fechaEntrega>2021-01-17</fechaEntrega>
          <totalFactura>90.00</totalFactura>
          <productos>
            <producto>
              <nombreProducto>Libro de Cocina</nombreProducto>
              <referencia>LC9876</referencia>
              <precio>45.00</precio>
              <unidades>2</unidades>
            </producto>
          </productos>
        </detallePedido>
      </pedido>

      <!-- pedido 3 (Nuevo cliente) -->
      <pedido>
        <cliente>
          <nombre>Marta</nombre>
          <apellidos>Ruiz Díaz</apellidos>
          <telefono>987654321</telefono>
          <direccion>
            <calle>Calle Falsa 123</calle>
            <ciudad>Barcelona</ciudad>
            <codigoPostal>08080</codigoPostal>
            <provincia>Barcelona</provincia>
          </direccion>
          <correoElectronico>marta.ruiz@gmail.com</correoElectronico>
          <fechaInclusion>2021-01-05</fechaInclusion>
        </cliente>
        <detallePedido>
          <numeroPedido>1003</numeroPedido>
          <fechaCompra>2021-01-15</fechaCompra>
          <fechaEntrega>2021-01-20</fechaEntrega>
          <totalFactura>200.00</totalFactura>
          <productos>
            <producto>
              <nombreProducto>Smartwatch Modelo X</nombreProducto>
              <referencia>SWX1024</referencia>
              <precio>200.00</precio>
              <unidades>1</unidades>
            </producto>
          </productos>
        </detallePedido>
      </pedido>

      <!-- pedido 4 (Cliente recurrente) -->
      <pedido>
        <cliente>
          <nombre>Carlos</nombre>
          <apellidos>Martín López</apellidos>
          <telefono>112233445</telefono>
          <direccion>
            <calle>Plaza Mayor 45</calle>
            <ciudad>Valencia</ciudad>
            <codigoPostal>46001</codigoPostal>
            <provincia>Valencia</provincia>
          </direccion>
          <correoElectronico>carlos.martin@gmail.com</correoElectronico>
          <fechaInclusion>2020-11-22</fechaInclusion>
        </cliente>
        <detallePedido>
          <numeroPedido>1004</numeroPedido>
          <fechaCompra>2021-01-18</fechaCompra>
          <fechaEntrega>2021-01-23</fechaEntrega>
          <totalFactura>60.00</totalFactura>
          <productos>
            <producto>
              <nombreProducto>Cafetera italiana</nombreProducto>
              <referencia>CF3487</referencia>
              <precio>60.00</precio>
              <unidades>1</unidades>
            </producto>
          </productos>
        </detallePedido>
      </pedido>
  
    </trimestre>
        <trimestre valor="2">
      <!-- pedido 1 para el segundo trimestre -->
      <pedido>
        <cliente>
          <nombre>Andrea</nombre>
          <apellidos>López Miranda</apellidos>
          <telefono>987654321</telefono>
          <direccion>
            <calle>Calle Princesa 25</calle>
            <ciudad>Valencia</ciudad>
            <codigoPostal>46005</codigoPostal>
            <provincia>Valencia</provincia>
          </direccion>
          <correoElectronico>andrea.lopez@gmail.com</correoElectronico>
          <fechaInclusion>2021-03-05</fechaInclusion>
        </cliente>
        <detallePedido>
          <numeroPedido>2001</numeroPedido>
          <fechaCompra>2021-04-01</fechaCompra>
          <fechaEntrega>2021-04-06</fechaEntrega>
          <totalFactura>85.00</totalFactura>
          <productos>
            <producto>
              <nombreProducto>Libro "El arte de la guerra"</nombreProducto>
              <referencia>LIB1234</referencia>
              <precio>15.00</precio>
              <unidades>2</unidades>
            </producto>
            <producto>
              <nombreProducto>Cuaderno A5</nombreProducto>
              <referencia>CUA5678</referencia>
              <precio>5.00</precio>
              <unidades>10</unidades>
            </producto>
          </productos>
        </detallePedido>
      </pedido>

      <!-- pedido 2 (Cliente recurrente) -->
      <pedido>
        <cliente>
          <nombre>Óscar</nombre>
          <apellidos>Gutiérrez Silva</apellidos>
          <telefono>912345678</telefono>
          <direccion>
            <calle>Av. Gran Vía 42</calle>
            <ciudad>Madrid</ciudad>
            <codigoPostal>28013</codigoPostal>
            <provincia>Madrid</provincia>
          </direccion>
          <correoElectronico>oscar.gutierrez@gmail.com</correoElectronico>
          <fechaInclusion>2020-08-22</fechaInclusion>
        </cliente>
        <detallePedido>
          <numeroPedido>2002</numeroPedido>
          <fechaCompra>2021-04-05</fechaCompra>
          <fechaEntrega>2021-04-10</fechaEntrega>
          <totalFactura>120.00</totalFactura>
          <productos>
            <producto>
              <nombreProducto>Camiseta básica blanca</nombreProducto>
              <referencia>CB1234</referencia>
              <precio>20.00</precio>
              <unidades>3</unidades>
            </producto>
            <producto>
              <nombreProducto>Jeans azul claro</nombreProducto>
              <referencia>JAC5678</referencia>
              <precio>60.00</precio>
              <unidades>1</unidades>
            </producto>
          </productos>
        </detallePedido>
      </pedido>

      <!-- pedido 3 (Nuevo cliente) -->
      <pedido>
        <cliente>
          <nombre>Elena</nombre>
          <apellidos>Fernández Ortiz</apellidos>
          <telefono>934567890</telefono>
          <direccion>
            <calle>Ronda de Sant Pere 56</calle>
            <ciudad>Barcelona</ciudad>
            <codigoPostal>08010</codigoPostal>
            <provincia>Barcelona</provincia>
          </direccion>
          <correoElectronico>elena.fernandez@gmail.com</correoElectronico>
          <fechaInclusion>2021-03-15</fechaInclusion>
        </cliente>
        <detallePedido>
          <numeroPedido>2003</numeroPedido>
          <fechaCompra>2021-04-08</fechaCompra>
          <fechaEntrega>2021-04-13</fechaEntrega>
          <totalFactura>230.00</totalFactura>
          <productos>
            <producto>
              <nombreProducto>Smartphone XBrand modelo Y</nombreProducto>
              <referencia>SMXY1234</referencia>
              <precio>230.00</precio>
              <unidades>1</unidades>
            </producto>
          </productos>
        </detallePedido>
      </pedido>
          <!-- pedido 4 (Cliente recurrente) -->
    <pedido>
      <cliente>
        <nombre>Lucía</nombre>
        <apellidos>González Herrero</apellidos>
        <telefono>956789123</telefono>
        <direccion>
          <calle>Calle Nueva 67</calle>
          <ciudad>Sevilla</ciudad>
          <codigoPostal>41001</codigoPostal>
          <provincia>Sevilla</provincia>
        </direccion>
        <correoElectronico>lucia.gonzalez@gmail.com</correoElectronico>
        <fechaInclusion>2020-05-20</fechaInclusion>
      </cliente>
      <detallePedido>
        <numeroPedido>2004</numeroPedido>
        <fechaCompra>2021-04-15</fechaCompra>
        <fechaEntrega>2021-04-20</fechaEntrega>
        <totalFactura>75.00</totalFactura>
        <productos>
          <producto>
            <nombreProducto>Bolígrafos de gel</nombreProducto>
            <referencia>BG2345</referencia>
            <precio>15.00</precio>
            <unidades>3</unidades>
          </producto>
          <producto>